{
  "schema_version": 1,
  "contract": "code_assist.notion.internal_collaborative_crdt_corpus.v1",
  "corpus_id": "E0-P1-COMMON-CRDT-CORPUS-001",
  "corpus_version": 1,
  "recorded_at": "2026-08-23T08:25:00Z",
  "packet_id": "E0-P1",
  "status": "frozen_runtime_neutral_not_executed",
  "authority_inputs": [
    {
      "path": "code_assist_v1/AGENTS.md",
      "sha256": "sha256:916383ca3674842d7dd2f9ef77af989b3b7dfe38e4c3f745072c6f9655d47549"
    },
    {
      "path": "code_assist_v1/docs/notion_parity/core_free_web_ui/INTERNAL_COLLABORATIVE_NOTION_ULTRA_EXECUTION_PLAN_V3.md",
      "sha256": "sha256:35de7238678c68ea889e271f3107c170fc233cefb667d455a34db42484e71377"
    },
    {
      "path": "code_assist_v1/docs/notion_parity/core_free_web_ui/INTERNAL_COLLABORATIVE_NOTION_XHIGH_IMPLEMENTATION_HANDOFF_V2.md",
      "sha256": "sha256:abaa2cc047e2b00e6e6d4abe1521743a3e0427eb1f6a2c64e4a7704254968912"
    },
    {
      "path": "code_assist_v1/docs/notion_parity/core_free_web_ui/internal_collaborative_crdt_candidate_matrix.v1.json",
      "sha256": "sha256:a97bde3c677acc198e1f451619367dcec20c59a76aa4934fe7f0905718831d57"
    },
    {
      "path": "code_assist_v1/docs/notion_parity/core_free_web_ui/internal_collaborative_authority_adr.v1.json",
      "sha256": "sha256:0dfa4ad9fd30a8daf50d42e9fe60ea0126928a2f4a73c8a51d7b518d28c439c2"
    },
    {
      "path": "code_assist_v1/docs/notion_parity/core_free_web_ui/internal_collaborative_completion_matrix.v1.json",
      "sha256": "sha256:60c35c589563c49730e6bfca7017a29d41a1a7fee2aff2a36e09cb850c2548da"
    }
  ],
  "canonical_document_contract": {
    "model": "ordered block tree with CRDT rich-text leaves and server-sequenced typed structure/database commands",
    "canonical_json": "UTF-8, NFC strings, sorted object keys, compact separators, integer numbers only",
    "canonical_hash": "sha256 of canonical JSON bytes",
    "included": [
      "block ids, types, parent ids, sibling order and non-ephemeral properties",
      "rich-text graphemes and marks",
      "database schema, row ids, cell values and stable ordering"
    ],
    "excluded": [
      "awareness and presence",
      "cursor and selection",
      "transport sequence and acknowledgement metadata",
      "wall-clock timestamps",
      "local undo stacks",
      "projection-only page timestamps"
    ],
    "candidate_specific_binary_hash_is_product_hash": false
  },
  "acknowledgement_contract": {
    "unit": "Unicode extended grapheme cluster after NFC normalization",
    "ack_point": "canonical authority durably accepts a client operation id and request hash",
    "zero_loss_rule": "Every acknowledged grapheme id appears exactly once in every converged visible state unless a causally authorized explicit delete names that exact id.",
    "duplicate_rule": "Duplicate delivery of one operation id never duplicates a grapheme or structural effect.",
    "delete_rule": "A structural conflict may retain, relocate, or tombstone a target according to the typed-command policy, but may not silently discard acknowledged rich text.",
    "ime_rule": "compositionstart and compositionupdate are local ephemeral state; one compositionend produces one acknowledged commit and one local undo unit.",
    "acknowledged_character_loss_budget": 0,
    "convergence_mismatch_budget": 0,
    "invalid_unicode_budget": 0
  },
  "actors": [
    {"id": "owner", "stable_rank": 10},
    {"id": "member", "stable_rank": 20},
    {"id": "guest", "stable_rank": 30}
  ],
  "delivery_schedules": [
    {
      "id": "CAUSAL_FORWARD",
      "rule": "Deliver every operation after all causally_after dependencies, then by actor stable_rank and operation id."
    },
    {
      "id": "CONCURRENT_REVERSE",
      "rule": "Within each causally ready set, deliver by descending actor stable_rank and descending operation id."
    },
    {
      "id": "DUPLICATE_EVERY_UPDATE",
      "rule": "Deliver every encoded update twice while preserving causal readiness."
    },
    {
      "id": "DETERMINISTIC_OUT_OF_ORDER",
      "rule": "Deliver a fixed non-causal wire order, buffer missing dependencies, then drain deterministically."
    },
    {
      "id": "RESTART_AFTER_HALF",
      "rule": "Persist the first deterministic half, close the process, reopen from durable state, and deliver the remainder."
    },
    {
      "id": "COMPACT_THEN_TAIL_REPLAY",
      "rule": "Verify and persist a checkpoint at the declared high-water, compact eligible history, then replay the tail twice."
    }
  ],
  "assertion_definitions": [
    {"id": "CONVERGED_CANONICAL_HASH", "rule": "Every replica and delivery schedule has one equal canonical document hash."},
    {"id": "ZERO_ACKNOWLEDGED_GRAPHEME_LOSS", "rule": "No acknowledged grapheme is absent without a causal explicit delete."},
    {"id": "NO_DUPLICATE_ACKNOWLEDGED_GRAPHEME", "rule": "No acknowledged grapheme id is visible more than once."},
    {"id": "NFC_AND_UNICODE_VALID", "rule": "All visible strings are NFC and contain valid Unicode scalar sequences."},
    {"id": "TYPED_STRUCTURE_VALID", "rule": "The block tree and database model satisfy their typed structural invariants."},
    {"id": "LOCAL_UNDO_PRESERVES_REMOTE", "rule": "Local undo removes only the local tracked origin and preserves concurrent remote effects."},
    {"id": "IME_INTERMEDIATE_NOT_BROADCAST", "rule": "No compositionupdate value becomes a durable or remote operation."},
    {"id": "IME_COMMIT_ONE_UNDO_UNIT", "rule": "Each compositionend commit is exactly one acknowledged local undo unit."},
    {"id": "RESTART_REPLAY_EQUIVALENT", "rule": "Restarted replay equals uninterrupted replay and contains no duplicate durable operation."},
    {"id": "COMPACTION_EQUIVALENT", "rule": "Checkpoint plus tail replay equals full-history replay."}
  ],
  "scenarios": [
    {
      "id": "TEXT-001",
      "category": "same_block_text",
      "description": "Concurrent inserts at the same rich-text anchor.",
      "initial_document": {"blocks": [{"id": "b1", "type": "paragraph", "text": "협업"}]},
      "initial_graphemes": [],
      "operations": [
        {"id": "text001-owner", "actor": "owner", "kind": "text_insert", "target": "b1:end", "causally_after": [], "payload": {"text": "은 빠르고"}, "acknowledged_graphemes": [{"id": "t1o1", "value": "은"}, {"id": "t1o2", "value": " "}, {"id": "t1o3", "value": "빠"}, {"id": "t1o4", "value": "르"}, {"id": "t1o5", "value": "고"}], "explicit_delete_ids": []},
        {"id": "text001-member", "actor": "member", "kind": "text_insert", "target": "b1:end", "causally_after": [], "payload": {"text": " 안전해야 한다"}, "acknowledged_graphemes": [{"id": "t1m1", "value": " "}, {"id": "t1m2", "value": "안"}, {"id": "t1m3", "value": "전"}, {"id": "t1m4", "value": "해"}, {"id": "t1m5", "value": "야"}, {"id": "t1m6", "value": " "}, {"id": "t1m7", "value": "한"}, {"id": "t1m8", "value": "다"}], "explicit_delete_ids": []}
      ],
      "schedule_ids": ["CAUSAL_FORWARD", "CONCURRENT_REVERSE", "DUPLICATE_EVERY_UPDATE", "DETERMINISTIC_OUT_OF_ORDER"],
      "assertion_ids": ["CONVERGED_CANONICAL_HASH", "ZERO_ACKNOWLEDGED_GRAPHEME_LOSS", "NO_DUPLICATE_ACKNOWLEDGED_GRAPHEME", "NFC_AND_UNICODE_VALID"],
      "expected_visible_fragments": ["협업", "은 빠르고", " 안전해야 한다"]
    },
    {
      "id": "TEXT-002",
      "category": "same_block_text",
      "description": "Concurrent insert and explicit delete over stable grapheme ids.",
      "initial_document": {"blocks": [{"id": "b1", "type": "paragraph", "text": "문서 편집"}]},
      "initial_graphemes": [{"id": "base-pyeon", "value": "편"}, {"id": "base-jip", "value": "집"}],
      "operations": [
        {"id": "text002-owner", "actor": "owner", "kind": "text_insert", "target": "b1:start", "causally_after": [], "payload": {"text": "공동 "}, "acknowledged_graphemes": [{"id": "t2o1", "value": "공"}, {"id": "t2o2", "value": "동"}, {"id": "t2o3", "value": " "}], "explicit_delete_ids": []},
        {"id": "text002-member", "actor": "member", "kind": "text_delete", "target": "b1:stable_ids", "causally_after": [], "payload": {}, "acknowledged_graphemes": [], "explicit_delete_ids": ["base-pyeon", "base-jip"]}
      ],
      "schedule_ids": ["CAUSAL_FORWARD", "CONCURRENT_REVERSE", "DUPLICATE_EVERY_UPDATE"],
      "assertion_ids": ["CONVERGED_CANONICAL_HASH", "ZERO_ACKNOWLEDGED_GRAPHEME_LOSS", "NO_DUPLICATE_ACKNOWLEDGED_GRAPHEME", "NFC_AND_UNICODE_VALID"],
      "expected_visible_fragments": ["공동 ", "문서"]
    },
    {
      "id": "FORMAT-001",
      "category": "rich_text_format",
      "description": "Concurrent text insertion and mark range update.",
      "initial_document": {"blocks": [{"id": "b1", "type": "paragraph", "text": "중요 내용", "marks": []}]},
      "initial_graphemes": [],
      "operations": [
        {"id": "format001-owner", "actor": "owner", "kind": "text_insert", "target": "b1:end", "causally_after": [], "payload": {"text": " 확인"}, "acknowledged_graphemes": [{"id": "f1o1", "value": " "}, {"id": "f1o2", "value": "확"}, {"id": "f1o3", "value": "인"}], "explicit_delete_ids": []},
        {"id": "format001-member", "actor": "member", "kind": "mark_set", "target": "b1:0..2", "causally_after": [], "payload": {"mark": "bold", "value": true}, "acknowledged_graphemes": [], "explicit_delete_ids": []}
      ],
      "schedule_ids": ["CAUSAL_FORWARD", "CONCURRENT_REVERSE", "DUPLICATE_EVERY_UPDATE"],
      "assertion_ids": ["CONVERGED_CANONICAL_HASH", "ZERO_ACKNOWLEDGED_GRAPHEME_LOSS", "NO_DUPLICATE_ACKNOWLEDGED_GRAPHEME", "NFC_AND_UNICODE_VALID", "TYPED_STRUCTURE_VALID"],
      "expected_visible_fragments": ["중요 내용", " 확인"]
    },
    {
      "id": "BLOCK-001",
      "category": "block_tree",
      "description": "Independent edits in different blocks.",
      "initial_document": {"blocks": [{"id": "b1", "type": "heading", "text": "계획"}, {"id": "b2", "type": "paragraph", "text": "초안"}]},
      "initial_graphemes": [],
      "operations": [